{
  "name": "W3Schools Content Taxonomy (Sample)",
  "version": "0.1.0",
  "categories": [
    {
      "id": "tutorials",
      "label": "Tutorials",
      "description": "Step-by-step learning content organized by language/technology",
      "topics": ["html", "css", "javascript", "python", "sql", "php", "java", "c", "cpp", "csharp", "react", "nodejs"]
    },
    {
      "id": "references",
      "label": "References",
      "description": "Quick-lookup reference tables and syntax guides",
      "topics": ["html-tags", "css-properties", "js-methods", "sql-keywords", "python-builtins"]
    },
    {
      "id": "exercises",
      "label": "Exercises",
      "description": "Interactive practice problems",
      "topics": ["html", "css", "javascript", "python", "sql"]
    },
    {
      "id": "quizzes",
      "label": "Quizzes",
      "description": "Multiple-choice knowledge tests",
      "topics": ["html", "css", "javascript", "python", "sql"]
    },
    {
      "id": "tools",
      "label": "Tools",
      "description": "Online editors, color pickers, and utility tools",
      "topics": ["tryit-editor", "color-picker", "code-game"]
    }
  ],
  "content_types": ["hub", "lesson", "reference", "exercise", "quiz", "tool"]
}
